UC 1- Ability to create a Address Book Service DB Use SQL Client to create DB.
______________________________________________________________________________________________________________________
mysql> Create database AddressBook_Service;
Query OK, 1 row affected (1.29 sec)

mysql> show databases;
+---------------------+
| Database            |
+---------------------+
| addressbook_service |
| country             |
| information_schema  |
| kajal               |
| mysql               |
| payroll_service     |
| performance_schema  |
| sakila              |
| sys                 |
| world               |
+---------------------+
10 rows in set (0.48 sec)

mysql> use addressbook_service;
Database changed
______________________________________________________________________________________________________________
UC 2 - Ability to create a AddressBook Table with first and last names, address, city, state, zip,
       phone number and email as its attributes.

       mysql> CREATE TABLE AddressBook(
           -> FirstName VARCHAR(30) NOT NULL,
           -> LastName VARCHAR(40) NOT NULL,
           -> Address VARCHAR(100) NOT NULL,
           -> City VARCHAR(30) NOT NULL,
           -> State VARCHAR(30) NOT NULL,
           -> PhoneNumber Varchar(10) NOT NULL,
           -> Email VARCHAR(40) NOT NULL);
       Query OK, 0 rows affected (5.06 sec)
       mysql> SHOW TABLES;
       +-------------------------------+
       | Tables_in_addressbook_service |
       +-------------------------------+
       | addressbook                   |
       +-------------------------------+
       1 row in set (0.28 sec)
________________________________________________________________________________________________________________
UC 3 - Ability to insert new Contacts to Address Book

    mysql> INSERT INTO ADDRESSBOOK(
        -> FirstName,LastName,Address,City,State,Zip,PhoneNumber,Email) VALUES
        -> ('Kajal','Wankhede','Nagpur','Nagpur','Maharashtra',7218448782,'kk@gmail.com'),
        -> ('Sonu','Gaikwad','Delhi','Delhi','Maharashtra',7218448782,'kk@gmail.com');
    Query OK, 2 rows affected (0.29 sec)
    Records: 2  Duplicates: 0  Warnings: 0

mysql> select * from addressbook;
+-----------+----------+---------+--------+-------------+------+-------------+--------------+
| FirstName | LastName | Address | City   | State       | Zip  | PhoneNumber | Email        |
+-----------+----------+---------+--------+-------------+------+-------------+--------------+
| Kajal     | Wankhede | Nagpur  | Nagpur | Maharashtra | NULL | 7218448782  | kk@gmail.com |
| Sonu      | Gaikwad  | Delhi   | Delhi  | Maharashtra | NULL | 7218448782  | kk@gmail.com |
+-----------+----------+---------+--------+-------------+------+-------------+--------------+
2 rows in set (0.00 sec)

______________________________________________________________________________________________________________
UC 4 - Ability to edit existing contact person using their name.

     mysql> update addressbook set Zip = '440024' where FirstName= 'Kajal';
     Query OK, 1 row affected (0.13 sec)
     Rows matched: 1  Changed: 1  Warnings: 0

     mysql> update addressbook set Zip = '441024' where FirstName= 'Sonu';
     Query OK, 1 row affected (0.07 sec)
     Rows matched: 1  Changed: 1  Warnings: 0

     mysql> select * from addressbook;
     +-----------+----------+---------+--------+-------------+--------+-------------+--------------+
     | FirstName | LastName | Address | City   | State       | Zip    | PhoneNumber | Email        |
     +-----------+----------+---------+--------+-------------+--------+-------------+--------------+
     | Kajal     | Wankhede | Nagpur  | Nagpur | Maharashtra | 440024 | 7218448782  | kk@gmail.com |
     | Sonu      | Gaikwad  | Delhi   | Delhi  | Maharashtra | 441024 | 7218448782  | kk@gmail.com |
     +-----------+----------+---------+--------+-------------+--------+-------------+--------------+
     2 rows in set (0.03 sec)

______________________________________________________________________________________________________________
UC 5 - Ability to delete a person using person's name

  mysql> DELETE FROM ADDRESSBOOK
      -> WHERE FirstName='Sonu';
  Query OK, 1 row affected (0.11 sec)

  mysql> select * from addressbook;
  +-----------+----------+---------+--------+-------------+--------+-------------+--------------+
  | FirstName | LastName | Address | City   | State       | Zip    | PhoneNumber | Email        |
  +-----------+----------+---------+--------+-------------+--------+-------------+--------------+
  | Kajal     | Wankhede | Nagpur  | Nagpur | Maharashtra | 440024 | 7218448782  | kk@gmail.com |
  +-----------+----------+---------+--------+-------------+--------+-------------+--------------+
  1 row in set (0.00 sec)

_______________________________________________________________________________________________________________
UC 6 -Ability to Retrieve Person belonging to a City or State from the Address Book.

    INSERT INTO ADDRESSBOOK(
        -> FirstName,LastName,Address,City,State,Zip,PhoneNumber,Email) VALUES
        -> ('Trusha','Bawane','Pune','Pune','Maharashtra',441122,7218448782,'kk@gmail.com'),
        ->  ('Payal','Sinha','Banglore','Banglore','Karnataka',412422,8976545678,'ps@gmail.com');
    Query OK, 2 rows affected (1.38 sec)
    Records: 2  Duplicates: 0  Warnings: 0
  mysql> SELECT * FROM ADDRESSBOOK WHERE City= 'Pune' OR State='Maharashtra';
    +-----------+----------+---------+--------+-------------+--------+-------------+--------------+
    | FirstName | LastName | Address | City   | State       | Zip    | PhoneNumber | Email        |
    +-----------+----------+---------+--------+-------------+--------+-------------+--------------+
    | Kajal     | Wankhede | Nagpur  | Nagpur | Maharashtra | 440024 | 7218448782  | kk@gmail.com |
    | Trusha    | Bawane   | Pune    | Pune   | Maharashtra | 441122 | 7218448782  | kk@gmail.com |
    +-----------+----------+---------+--------+-------------+--------+-------------+--------------+
    2 rows in set (0.15 sec)

    mysql> SELECT * FROM ADDRESSBOOK WHERE City= 'Banglore' OR State='Karnataka';
    +-----------+----------+----------+----------+-----------+--------+-------------+--------------+
    | FirstName | LastName | Address  | City     | State     | Zip    | PhoneNumber | Email        |
    +-----------+----------+----------+----------+-----------+--------+-------------+--------------+
    | Payal     | Sinha    | Banglore | Banglore | Karnataka | 412422 | 8976545678  | ps@gmail.com |
    +-----------+----------+----------+----------+-----------+--------+-------------+--------------+
    1 row in set (0.03 sec)

______________________________________________________________________________________________________________
UC 7- Ability to understand the size of address book by City and State
     - Here size indicates the count

   mysql> select * from addressbook;
   +-----------+----------+----------+----------+-------------+--------+-------------+--------------+
   | FirstName | LastName | Address  | City     | State       | Zip    | PhoneNumber | Email        |
   +-----------+----------+----------+----------+-------------+--------+-------------+--------------+
   | Kajal     | Wankhede | Nagpur   | Nagpur   | Maharashtra | 440024 | 7218448782  | kk@gmail.com |
   | Trusha    | Bawane   | Pune     | Pune     | Maharashtra | 441122 | 7218448782  | kk@gmail.com |
   | Payal     | Sinha    | Banglore | Banglore | Karnataka   | 412422 | 8976545678  | ps@gmail.com |
   +-----------+----------+----------+----------+-------------+--------+-------------+--------------+
   3 rows in set (0.00 sec)

   mysql> SELECT COUNT(City),COUNT(State) FROM ADDRESSBOOK;
   +-------------+--------------+
   | COUNT(City) | COUNT(State) |
   +-------------+--------------+
   |           3 |            3 |
   +-------------+--------------+
   1 row in set (1.17 sec)

_____________________________________________________________________________________________________________
UC 8- Ability to retrieve entries sorted alphabetically by Person’s name for a given city.


     mysql> SELECT * FROM ADDRESSBOOK ORDER BY FirstName;
     +-----------+----------+----------+----------+-------------+--------+-------------+--------------+
     | FirstName | LastName | Address  | City     | State       | Zip    | PhoneNumber | Email        |
     +-----------+----------+----------+----------+-------------+--------+-------------+--------------+
     | Kajal     | Wankhede | Nagpur   | Nagpur   | Maharashtra | 440024 | 7218448782  | kk@gmail.com |
     | Payal     | Sinha    | Banglore | Banglore | Karnataka   | 412422 | 8976545678  | ps@gmail.com |
     | Trusha    | Bawane   | Pune     | Pune     | Maharashtra | 441122 | 7218448782  | kk@gmail.com |
     +-----------+----------+----------+----------+-------------+--------+-------------+--------------+
     3 rows in set (0.31 sec)

________________________________________________________________________________________________________________
UC 9- Ability to identify each Address Book with name andType. - Here the type could Family, Friends,
      Profession, etc - Alter Address Book to add name and type

   mysql> ALTER TABLE ADDRESSBOOK  ADD NAME VARCHAR(20);
   Query OK, 0 rows affected (4.74 sec)
   Records: 0  Duplicates: 0  Warnings: 0

   mysql> ALTER TABLE ADDRESSBOOK  ADD TYPE VARCHAR(20) DEFAULT 'FAMILY';
   Query OK, 0 rows affected (0.20 sec)
   Records: 0  Duplicates: 0  Warnings: 0

   mysql> select * from addressbook;
   +-----------+----------+----------+----------+-------------+--------+-------------+--------------+------+--------+
   | FirstName | LastName | Address  | City     | State       | Zip    | PhoneNumber | Email        | NAME | TYPE   |
   +-----------+----------+----------+----------+-------------+--------+-------------+--------------+------+--------+
   | Kajal     | Wankhede | Nagpur   | Nagpur   | Maharashtra | 440024 | 7218448782  | kk@gmail.com | NULL | FAMILY |
   | Trusha    | Bawane   | Pune     | Pune     | Maharashtra | 441122 | 7218448782  | kk@gmail.com | NULL | FAMILY |
   | Payal     | Sinha    | Banglore | Banglore | Karnataka   | 412422 | 8976545678  | ps@gmail.com | NULL | FAMILY |
   +-----------+----------+----------+----------+-------------+--------+-------------+--------------+------+--------+
   3 rows in set (0.02 sec)

   mysql> ALTER TABLE ADDRESSBOOK  ADD TYPE VARCHAR(20);
   ERROR 1060 (42S21): Duplicate column name 'TYPE'
   mysql> update addressbook set TYPE = 'FRIENDS' where FirstName= 'Trusha';
   Query OK, 1 row affected (0.10 sec)
   Rows matched: 1  Changed: 1  Warnings: 0

   mysql> select * from addressbook;
   +-----------+----------+----------+----------+-------------+--------+-------------+--------------+------+---------+
   | FirstName | LastName | Address  | City     | State       | Zip    | PhoneNumber | Email        | NAME | TYPE    |
   +-----------+----------+----------+----------+-------------+--------+-------------+--------------+------+---------+
   | Kajal     | Wankhede | Nagpur   | Nagpur   | Maharashtra | 440024 | 7218448782  | kk@gmail.com | NULL | FAMILY  |
   | Trusha    | Bawane   | Pune     | Pune     | Maharashtra | 441122 | 7218448782  | kk@gmail.com | NULL | FRIENDS |
   | Payal     | Sinha    | Banglore | Banglore | Karnataka   | 412422 | 8976545678  | ps@gmail.com | NULL | FAMILY  |
   +-----------+----------+----------+----------+-------------+--------+-------------+--------------+------+---------+
   3 rows in set (0.00 sec)

   mysql> update addressbook set TYPE = 'PROFESSION' where FirstName= 'Payal';
   Query OK, 1 row affected (0.10 sec)
   Rows matched: 1  Changed: 1  Warnings: 0

   mysql> select * from addressbook;
   +-----------+----------+----------+----------+-------------+--------+-------------+--------------+------+------------+
   | FirstName | LastName | Address  | City     | State       | Zip    | PhoneNumber | Email        | NAME | TYPE       |
   +-----------+----------+----------+----------+-------------+--------+-------------+--------------+------+------------+
   | Kajal     | Wankhede | Nagpur   | Nagpur   | Maharashtra | 440024 | 7218448782  | kk@gmail.com | NULL | FAMILY     |
   | Trusha    | Bawane   | Pune     | Pune     | Maharashtra | 441122 | 7218448782  | kk@gmail.com | NULL | FRIENDS    |
   | Payal     | Sinha    | Banglore | Banglore | Karnataka   | 412422 | 8976545678  | ps@gmail.com | NULL | PROFESSION |
   +-----------+----------+----------+----------+-------------+--------+-------------+--------------+------+------------+
   3 rows in set (0.00 sec)


_______________________________________________________________________________________________________________________________________
UC 9 - Ability to get number of contact persons i.e. count by type

    mysql> SELECT COUNT(TYPE) FROM ADDRESSBOOK;
    +-------------+
    | COUNT(TYPE) |
    +-------------+
    |           3 |
    +-------------+
    1 row in set (0.06 sec)

_____________________________________________________________________________________________________________________